<?xml version="1.0" encoding="UTF-8"?>
<project xmlns="http://www.biticcf.com" 
         xmlns:xsi="http://www.w3.org/2001/XMLSchema-instance" 
         xsi:schemaLocation="http://www.biticcf.com generator.xsd">
  <properties>
    <name>MyProj</name>
    <company>biticcf</company>
    <scope>flying</scope>
    <template>hill</template>
  </properties>
  
  <facades>
    <facade>
      <name>Demon</name>
      <methods>
        <method>
          <name>queryById</name>
          <returnRealType><![CDATA[com.biticcf.flying.hill.model.DemoModel]]></returnRealType>
          <params>
            <param>
              <name>id</name>
              <type><![CDATA[java.lang.Integer]]></type>
            </param>
            <param>
              <name>size</name>
              <type><![CDATA[java.lang.Long]]></type>
            </param>
          </params>
          <requestMapping>
            <requestPaths>
              <requestPath>/demo</requestPath>
            </requestPaths>
            <requestMethods>
              <requestMethod>GET</requestMethod>
            </requestMethods>
            <requestProduces>
              <requestProduce>application/json</requestProduce>
            </requestProduces>
          </requestMapping>
        </method>
      </methods>
    </facade>
  </facades>
</project>
