<?xml version="1.0" encoding="UTF-8"?>
<project xmlns="http://www.biticcf.com" 
         xmlns:xsi="http://www.w3.org/2001/XMLSchema-instance" 
         xsi:schemaLocation="http://www.biticcf.com generator.xsd">
  <!-- 非空 -->
  <properties>
    <!-- 非空,项目名称 -->
    <name>MyProj</name>
    <!-- 非空,只允许出现小写字母 -->
    <company>biticcf</company>
    <!-- 非空 -->
    <scope>ocean</scope>
    <!-- 非空 -->
    <template>sea</template>
    <!-- 可空,默认是false,true表示覆盖已存在的文件,false表示先做备份再做覆盖 -->
    <override>false</override>
    <!-- 可空,慎重填写,会覆盖默认定义的文件夹 -->
    <dirs>
      <dir>
        <name>model</name>
        <value>com/biticcf/ocean/sea/model</value>
      </dir>
      <dir>
        <name>facade</name>
        <value>com/biticcf/ocean/sea/facade</value>
      </dir>
      <dir>
        <name>controller</name>
        <value>com/biticcf/ocean/sea/web/controller</value>
      </dir>
      <dir>
        <name>service</name>
        <value>com/biticcf/ocean/sea/service</value>
      </dir>
      <dir>
        <name>domain</name>
        <value>com/biticcf/ocean/sea/domain</value>
      </dir>
    </dirs>
  </properties>
  
  <!-- 可空,采用默认方案(建议保持默认) -->
  <models>
    <model>
      <name>api</name>
      <includeDirs>
        <dirRef>model</dirRef>
        <dirRef>facade</dirRef>
      </includeDirs>
    </model>
    <model>
      <name>server</name>
      <includeDirs>
        <dirRef>controller</dirRef>
        <dirRef>service</dirRef>
        <dirRef>domain</dirRef>
      </includeDirs>
    </model>
  </models>
  
  <facades>
    <facade>
      <!-- Facade名称前缀,只允许大写字母开头,后面跟小写字母 -->
      <name>Deem</name>
    </facade>
  </facades>
</project>
